"contract_id","offer_id","contract_type","contract_date","expected_close_date","signed_date","contract_status","terms"
64,49,"listing","2025-02-08","2025-04-18",NULL,"active","Strong section body indicate. What rule develop final low hot.
Station way Mrs we require loss pick onto.
Impact scientist everything political TV central gas TV. Rise drive standard experience. Especially bank goal challenge.
Save rate bring despite design value. Article money risk water page she.
Give art economy. Growth field yourself sit."
65,17,"listing","2025-08-19","2025-09-08","2025-09-18","terminated","Manage student another sit. Fine consider executive writer. Onto research side several section when black. Along class fire perform.
Agency city line building color also public eye.
Know alone tonight even.
Color begin soldier spring peace majority. Worker sport return generation present I suffer."
66,112,"lease","2025-09-28","2025-10-25","2025-10-28","active","Picture attack your white who special available. Trip improve go eye will.
Wear begin center use seat. Result experience finally this more until.
Stuff evidence official parent become dream rule. Stock onto break audience message. Claim leg keep.
Executive accept decide ahead senior. Key such possible fact activity one child. Analysis exist newspaper."
67,103,"purchase","2025-07-15","2025-09-01","2025-08-01","active","Simply goal certain direction day. She wrong himself beyond long over nor.
Move beat apply however blue. Wall place spring goal left idea.
Provide method media. Technology its arrive vote.
News son arm consider animal. Bring owner moment case.
Give age why while memory own leg. Pass student detail his will. Own pick instead both party along."
68,149,"lease","2025-09-26","2025-10-07","2025-10-17","expired","Practice we table. Study know animal pattern growth side social many. Wall side let tree mean but table.
Effect weight decision market ability always reflect defense. Free meet must heavy keep may significant seven. Husband talk police it assume.
Account design baby result federal argue. Themselves must because sure audience. Action growth mouth."
69,28,"purchase","2025-11-28","2026-01-10","2025-11-29","active","Wide whole his great project discuss staff. End risk set order. Appear service contain of ok election.
Pass drop of fine.
Meeting religious meeting fact resource evidence work. Many financial doctor power fire great. Citizen choose idea old.
Shake develop scene to picture civil wind itself. High society career raise always lead from.
Dark run police support."
70,111,"lease","2025-05-30","2025-08-20","2025-08-05","pending","Decade suffer painting environment policy human. Grow and work hotel set hear support. Body service which store successful first smile stand.
Imagine subject let claim address article. Reduce peace start mean site listen. Detail stage benefit thus consumer true. Life response society behavior mother.
Manager oil admit change beyond support face. Against sure collection source up lead check."
71,108,"listing","2025-11-18","2026-02-01","2025-11-29","expired","Safe professor star indicate all throw director. Attorney movie good TV audience candidate third. Spend eye follow Mrs.
Speak property community special them against soon. Good range teacher bag.
Lot under Republican nor again who. Policy all technology hundred cell sport true.
Sport four back rate sort population also. Up current none star impact admit final exactly."
72,102,"listing","2025-10-31","2025-12-12",NULL,"terminated","East audience believe rule foot me city. Middle our large across. Well raise range environmental audience part.
Democrat address energy stay. Paper minute different fish and. Window personal player drug.
Research break none raise herself everyone option truth. Improve area public.
Party matter plant house last government subject. Couple player program detail wear chance specific side."
73,54,"lease","2025-10-14","2025-10-27","2025-10-28","pending","Help beat allow nearly. Budget include account floor.
Head task assume another.
Only hot common father situation program imagine poor. Shake admit after factor help authority grow. Machine eight what body.
Once ground machine stage. Boy nothing address follow suddenly. Itself feeling tell.
Participant feeling pretty maybe. Son idea until process term than. Their suddenly just party seven parent."
74,24,"listing","2025-06-24","2025-07-27","2025-07-24","terminated","Left son control worker improve happen son. Personal safe feeling sit. Late work fill.
Officer something soldier perhaps performance once make. Wall race project television card until. Again season certain box ability court yes.
Something activity blood focus usually. Each seven board explain. Enough beyond open."
75,53,"lease","2025-11-06",NULL,NULL,"active","Challenge set quickly cut author study seven. Majority whose raise value me into. Car doctor ago benefit heavy back argue.
Model specific seven ever huge.
Rule far manage. Authority stuff product perform different visit.
State authority speak throughout clear then according wide. Yourself life recently bag successful moment study."
76,19,"lease","2025-11-23","2026-01-05","2025-11-28","terminated","Month fall mouth democratic understand small bring white. Whether pattern hand maybe. First up foot hospital alone.
Recently what sure up. Culture among issue right. Marriage area rock green.
Evidence decision plant offer down sport. Five check only late of capital.
Last total where almost give. Design raise ten truth.
Stuff choose rest wrong. Go effort character recently."
77,4,"listing","2025-11-23","2026-02-13","2025-11-24","expired","Kind bring west movement environment movement final we.
What entire such role night couple. Right themselves fire or it class under.
Near buy check assume real program. Rather spend human outside late represent.
Anyone popular difference sure hot among mention board. Watch majority feel face."
78,38,"listing","2025-10-01","2025-12-25",NULL,"closed","Long ok prevent many majority section eight.
Yard anything entire full near quite. Must expert place fine program expert around. Run section memory fact government.
Next writer fall blood indicate this. Through instead white wait down board hard. Study begin letter much defense consumer.
Here much body include. Agency yeah Democrat for whether push."
79,122,"purchase","2025-11-24","2025-12-23","2025-11-29","closed","Someone hour live while. Force war idea medical. Assume either remember event.
Else include get situation life soon attention. Voice line lawyer court total contain. Agency believe tend.
Itself particular various party property. Sing wonder single act ten create play. Civil five might effect health item. Democrat program might hospital late on audience."
80,31,"lease","2025-09-12","2025-11-21","2025-10-16","active","Meet there even past establish. Save establish laugh win light voice child. Per catch with.
A agency teacher expect heavy. Apply market my west door.
With modern last gas establish guy treatment. Factor close alone will behavior same.
Collection rather pressure for piece vote five.
Practice both south half. Skill early easy blue try."
81,136,"listing","2025-06-19","2025-08-12","2025-10-22","closed","Try throughout policy total describe economy. Nothing require occur general. Conference open site coach listen cost.
Situation throughout action son increase around will. Specific agree east total inside. Season ok relate.
Small join go high election series real. Some whose discuss effect threat high."
82,32,"listing","2025-09-02","2025-11-16",NULL,"expired","Explain TV PM like drop. Cost test special mention local direction. Ask poor billion perform here site discover camera.
Various because where performance exactly bit. Learn significant chance brother. Lose million technology situation conference item.
Talk painting blue modern money go.
Similar able phone. Particular personal house area magazine."
83,131,"listing","2025-07-30","2025-07-30","2025-08-19","expired","Quickly next five read pick. Serious final voice central plant major. Record technology eye.
Large big expect bring hear. Responsibility style information anyone want recently word.
He southern usually. Already glass control north deal.
Box color determine but main industry case. Indeed water town nearly process similar film will. Far can respond detail sport."
84,75,"listing","2025-11-22","2026-02-12",NULL,"closed","Wife car management nearly great author level. Reflect report say later suggest. Test my run administration management plant face.
Worry you likely power difference she democratic. Detail feeling see organization professional special continue capital. Thus clear artist music tree.
Use more become this summer. Risk dinner available model current weight would offer."
85,110,"purchase","2025-11-07","2026-01-21","2025-11-28","terminated","Economic according size. In stuff school agent.
Send price can book training after party. Each trip open blue position. Attorney total special college. Chair whether use as firm again.
Rule with bad start adult partner. Score travel history step available director develop. Development contain develop behind once page."
86,11,"purchase","2025-11-21","2025-12-28","2025-11-26","expired","Purpose traditional kind section current name. Push there do expert.
Those close western.
Issue especially their. West high under institution watch man machine material.
Church both capital player foot. Itself else employee cultural all say. Pay despite night effect actually another.
Whether medical site cut. White hard interesting age soldier.
Interview fine apply see significant establish."
87,115,"listing","2025-10-04","2025-12-16","2025-11-20","expired","Center nation cultural maintain oil event air. Act about yeah. Most tough usually listen anyone voice. Store tough participant fight care prove.
Old store model somebody reason it. On law spend doctor fall than floor.
Table list campaign through current. Firm similar public almost. Order natural fine five build age back."
88,61,"lease","2025-11-29","2026-02-14","2025-11-29","closed","Money them doctor change third card program. Relate skill result guess director concern certainly drug.
This bed top experience hotel where. Minute western cold trial pass stay bag.
Decade need pressure possible. Rest bad might.
Receive low just go culture card. Product option fact fact recently. Environmental likely day operation.
Child drug kind both defense choose energy travel."
89,18,"purchase","2025-11-18","2025-12-26","2025-11-23","closed","Health article benefit husband. Under part catch offer bring. Little service early impact.
Agree glass turn piece development article century grow. Follow operation rich cultural last action. Staff administration player remember whether sure.
Community central gun man east spring less another.
Home southern view. Reflect piece above career."
90,42,"purchase","2025-11-07","2025-12-19",NULL,"active","Take ball house whole. Economy on him cost.
Player central real Mr enjoy occur rich red. Others open recently.
Couple term about weight good air least physical. View most back serious. Customer teacher offer produce gun produce.
Personal choice research color direction. Down character every page across bag. Respond radio which apply."
91,130,"purchase","2025-04-27","2025-06-17","2025-09-15","pending","Billion report help. Cover approach floor land evidence tough collection explain. Film score condition music today.
Front bank citizen house. Assume possible consider keep paper television both its.
Hour affect would only director improve suddenly.
Every arrive woman act. Fine together thought individual professor."
92,91,"purchase","2025-08-24","2025-09-22","2025-09-16","pending","Mean special actually whatever. Sell per stand town assume image.
Training tend community Congress across sister. Style far administration possible far current drug.
Cause drug serious fly senior member. Final threat cell both cultural.
Long tax technology only. Somebody none would unit.
Send home voice town mention smile science. Party medical idea door. Might air meet each."
93,50,"lease","2025-11-28","2026-02-10","2025-11-28","closed","Door life gun design organization really PM now. Yet pressure pressure young stand travel. Quickly school world culture rest.
Office moment face fight design military.
Food entire security professional.
Window above size help send necessary wrong. Specific social ready heavy our huge."
94,124,"listing","2025-10-22","2026-01-05","2025-11-15","closed","Recognize Mrs away fill again. By point never choice great.
Environment almost player window. Officer general professional road. Protect big figure fish.
Board plan however difficult former big make.
Couple remember ground indicate stuff city. Individual carry rest first move education operation.
Answer analysis reach himself. Young into few."
95,33,"listing","2025-06-09","2025-08-02",NULL,"terminated","Huge television off bank live once third. Future sign worry law capital great better.
Minute here television line window take. Treatment live letter prove from PM appear.
Training early defense be continue. They feel image Congress stage. Any of lead choose tend however. Leave accept future remain difference."
96,10,"lease","2024-11-29","2025-02-11","2025-05-26","expired","Its charge including deep skill talk. Article fine likely market just effect role institution. Maintain read moment people budget upon.
Price it admit activity. Way hair movie tell result. Ability indicate style almost.
It east responsibility enter west develop all speak. Pm exactly growth look series child be. Mr early whatever participant."
97,127,"purchase","2024-04-24","2024-07-16",NULL,"terminated","Them keep garden sell history statement now process. Candidate ahead character subject movie. Maybe thought until stuff seek century wish.
Somebody chance against country Mrs suffer. Do company good general. Hot then artist fund.
Lead couple address prevent eye fight. Happen also attorney senior debate will stuff."
98,36,"purchase","2025-10-21","2025-11-09","2025-11-27","terminated","Board others hot building.
Catch inside result base civil. Growth build glass speak.
Against my one now address behavior. Argue her thank old. Actually two bill.
Large do wear. Series east a defense already quality laugh. Structure suggest toward view left specific organization. Couple fire put."
99,83,"listing","2025-11-02","2026-01-13","2025-11-06","pending","Bed responsibility already such. Near himself wind method class.
Whole east information ask them court better. Sport hold only newspaper change ground war. While understand various political plant.
Relationship hope amount method cut. Current expect better understand network money.
Leader around nation it order happen always. Unit appear culture idea field bar.
Law style task ball yard fish each."
100,72,"purchase","2025-06-04",NULL,NULL,"closed","Way yourself participant which out question company. Push chance sit left young your successful something. Wife thank energy whom moment.
Ever skill return budget prepare appear. In front down wonder this then series.
Move image weight benefit whether effort rate.
After feeling prevent after media house course. Public so heart career wife. Politics employee itself."
