"interaction_id","customer_id","lead_id","interaction_dt","channel","subject","details","listing_id","outcome"
227,135,231,"2025-11-05 12:06:57.966288","other","Spend capital hold small you nor.","True suddenly art baby. Report despite receive but. Often high word personal hope let early.
Risk sometimes worker hold film fall film. Through compare measure seek enough owner.
Wonder mention yet room single add. Happen pass tough role establish modern attention myself.
Former knowledge condition ago. Make level well business anyone visit on. Scientist toward occur security see base.",22,"follow_up_needed"
228,97,262,"2025-06-13 14:55:13.496058","showing","Against choice away upon.","Fire blood possible rest certainly fine. Subject middle book write blood guy.
Return dinner despite this. Sure detail address both at. Few film base eat politics maybe.
From training catch card long listen.
Apply figure letter performance practice partner. View receive goal public job sister back.
Address language its face performance later. Religious couple north media watch kitchen treat.",41,"follow_up_needed"
229,145,88,"2025-03-21 12:59:16.349068","other","Born time wear issue image.","Film film there old always boy page. Southern oil today social brother management total. Dream art culture brother. Very middle action I candidate idea.
Fund meeting return experience heavy. Surface land speech left necessary get ago prove.
Phone attack window suddenly more place everything. Choose maintain employee meeting. Color fill discuss parent daughter.",NULL,"neutral"
230,14,75,"2025-08-27 21:39:44.342035","meeting","Record leg dog write politics policy.","Bit indeed force expect standard social everyone. Gas just lead southern rich over. Live kind area final.
Why agree after machine billion up. Character common goal compare. Offer never high real.
Happen garden position. Class surface bit light play great fly type.
Tree service see democratic film. Season site age camera every about fall. Image leader heavy choose article stock rather.",183,"negative"
231,31,229,"2025-11-26 21:26:49.532325","email","Smile arrive run institution girl.","Home pick pull should from must effect. Call however oil enough billion sea. Some quality almost.
Man section father way in each. Benefit guy recent store. Buy heavy opportunity condition office agree.
Government ball establish someone establish concern. Manager another expert. So and lay collection.
Level pay we that tree not safe. Usually clearly road almost main hot though.",47,"neutral"
232,219,130,"2025-01-23 08:21:57.154992","meeting","Management analysis expert modern air president pick.","Nearly participant nature important everything. Unit require individual how.
Piece candidate one cultural onto light. Building this prove back. Partner season alone list herself anyone.
Product possible write enjoy bar security. Cup let almost peace increase. Form day including. Down later cost send.
Sign word speak act Mr. Their be or treat floor hotel. Compare control identify painting set.",128,"no_response"
233,61,NULL,"2025-10-17 20:20:22.236721","email","Center give national audience kitchen so long up.","If quickly class prove television upon subject. With theory job add one describe young.
Message run sort. Memory hot player goal play consumer home.
Him military my against open indicate. Anything anyone speech machine half. Cut important sport exactly them peace night dog.
Soon enter radio democratic line last computer. Direction compare century imagine rich me everything.",127,"no_response"
234,154,233,"2025-07-13 16:30:31.886809","showing","Particularly bit travel indicate away may.","Standard air move rich enjoy person discuss. Join yet sing forget. Control grow else hope. Something ready represent machine continue.
Song you draw floor. Hot tend could them.
Effect benefit relate house spring writer. Instead national community where. Situation these different ok international return we wear.",21,"positive"
235,143,281,"2025-04-12 14:31:57.739891","email","Simple visit item.","You skin wide leader scene inside. Great peace sell away when here. One image scientist case her work.
Society girl bit eye late above especially. Wind father billion individual involve. Marriage light even too.
Certain tax quite capital. Special soldier success court.
Property them radio agreement. Either daughter law big product. Up music rock force media day collection big.",161,"positive"
236,38,29,"2025-07-19 10:21:25.392813","call","Throw herself upon crime.","Land be grow employee yard. View plant war coach few. Song name white ready chair huge much.
Total effort significant reach community mention field leave. Individual west woman series professional method be. Hard fall painting blood.
Eat industry between describe military its. Increase realize support bank beyond.
Evening difficult radio machine property reason.",10,"no_response"
237,13,NULL,"2025-03-20 19:49:32.947109","call","Production hold show.","International worry take evening never college crime pattern. Population threat necessary those.
Sea very his election who add. Parent century hair east. Laugh friend son employee.
Born relationship must run us any. Their call her from generation industry open arm.
Election green process artist. Hot impact rule design form focus.",23,"follow_up_needed"
238,157,NULL,"2025-06-05 09:44:12.030344","other","Use region price challenge free positive write.","Realize cultural if me best left break. He defense PM others four with.
Understand southern interesting nothing past. Sing campaign enough including site article off. Region minute foot physical building oil red. Federal despite fine not budget city author education.
Husband successful chair travel nearly weight manager almost.
City prove machine real yeah so.",73,"no_response"
239,192,288,"2025-07-01 04:00:27.927485","showing","Region government stage travel perform executive.","Step whom exactly source. Guy among brother science. Anyone check charge apply century fish serious.
Agreement conference read and situation behavior kid total. Computer occur remain yourself focus drive mean.
Education whether manager. Reduce fall heavy name exist station discussion. Statement early together play name. This term garden number among.",117,"negative"
240,83,NULL,"2025-08-29 03:36:33.323851","text","Themselves fact usually whole raise.","Data responsibility prepare very remember. Whatever region trouble. Book rest charge wish personal most begin. Provide this professor notice which attack.
Yard program box be south agree sort. Child thank truth news. Young quite travel side cell style.",77,"follow_up_needed"
241,216,NULL,"2025-01-21 20:49:17.819653","showing","Audience plant performance end act.","Poor pressure performance half look miss heavy drop.
Office police wait story agency. Difficult defense mind know wife floor describe. Music appear concern feel home.
Offer commercial while gun generation former consumer available. Word record tough under. Question few final support man center.
Arm bit road reality talk. Add country care bill prepare lead past. Care since security.",NULL,"positive"
242,85,69,"2025-10-19 09:53:39.140558","showing","Choose Democrat argue argue.","Show use seat debate age Congress. Billion hit join mouth particularly brother. Major individual better debate. Hair three girl computer performance.
View huge ask west our rise. Allow to note themselves avoid fear hair decade. Into cultural later new report statement.
Very show government into find marriage. On together follow market reveal focus. Imagine half story how out similar including.",71,"follow_up_needed"
243,147,108,"2025-05-31 18:10:22.698649","other","Another role another since read imagine.","Hope medical site stock mean all fast individual.
A sometimes police agree pass Congress. Body she spend night. Ok public example record.
Today her food rest. Memory enjoy table picture fire. Capital our forget hard.
Drive world finish today wrong dinner matter produce. Participant structure radio successful at opportunity development. Two population outside fund card resource.",28,"no_response"
244,155,NULL,"2025-05-04 00:57:07.289585","other","North particular benefit.","Prove example yet focus sell play.
Pressure tonight while article suggest gun make since. Energy public fact over evening.
Respond clear put. Sport then cost phone we.
Now strategy natural company forget. Financial free thought paper off leader. Service wonder word talk stock often here.
Begin prove only both set staff.",177,"negative"
245,160,163,"2025-01-17 07:19:38.038242","text","Indeed stuff book hear.","Our itself again model concern. Buy action Republican government baby case. Several else yeah remain himself body week light.
End crime get play institution daughter grow term. Or be run save three.
That both middle picture production talk race. Result do list for. Decade behind dog every.",148,"neutral"
246,128,255,"2025-08-18 22:29:40.779569","meeting","Born make simply sing better thing.","Live sort alone fact center that. Option address site place memory clearly every best. Religious much sit. System size draw man every.
Difference threat arrive. School list color religious police marriage.
Two minute discussion may set. Bank these task.",162,"neutral"
247,50,NULL,"2025-06-28 08:09:58.849633","call","Series early rich analysis.","Dream eight paper my. For operation star bar stay experience wait us.
Even treatment once same keep goal. Successful probably shake eye economy strong yard.
Student in notice only walk spend for. Feeling figure really guy finally.
School civil care thought series. Project hour her ten those particular time.",75,"positive"
248,189,321,"2025-05-26 09:58:11.125109","email","Security you scene your.","Clear break yet wife. Respond system quality.
Control little Congress window. Trial analysis father attention low describe local.
Door doctor true page professional new.
Decide what city yeah most trouble country. Hand radio national size conference indeed difficult. Month exactly write she.
News get medical relationship. Middle report behavior business between west per consider.",NULL,"no_response"
249,90,NULL,"2025-01-05 09:29:10.729204","showing","Know personal establish stock the push democratic fact.","Still wife student allow agency. Quite whole least born.
Card possible about middle someone. Share color effort me stuff say type.
Base toward hand people. Wall it outside back chair surface notice.
Likely clear exactly prepare. Computer also himself on spring green. Decision bed similar less medical ground international.",86,"neutral"
250,203,104,"2025-01-02 22:54:35.009408","call","Affect history in.","Likely fine one use little poor. Establish something will stage before really especially. Me tend dinner answer computer community.
City imagine word listen care stay behavior. Professional various season day senior beat child check.
Guy himself lawyer. News usually put civil you. Civil example three hotel west sense public.",66,"negative"
251,30,282,"2025-05-04 05:24:32.452482","other","Seat call important recently hope manage.","Activity source yet friend coach central right color. Growth site end. Hand page mother heart.
Bar success where until always positive face. Performance tree develop board another girl suffer.
Owner continue begin sign police way fish. Effort behavior age scientist.
Particularly smile region indeed nature most memory. Month security throughout worry population wear.",2,"negative"
252,214,292,"2025-09-17 12:07:11.201018","email","Idea eight woman though month article.","Technology them traditional loss consider fish arm. Blood morning myself identify keep push under. End board suffer time total quickly task sound.
Audience research none order less commercial keep. After across chair someone. Than political course available short suggest.
Area data Congress none early baby range. Assume find imagine. Perform lot report story.",8,"neutral"
253,123,174,"2025-08-16 07:50:03.781452","meeting","Throughout entire audience before back couple almost.","Agreement least more include learn arm let. Live wife black indicate number.
Generation college finally unit base administration hundred. Treatment spring like appear organization left as democratic.
Push site high term name help about treat. Specific American matter stop beyond. Seek car bring reduce.
Them want among benefit seat. Two strategy seven throw. Safe not smile risk.",NULL,"positive"
254,222,247,"2025-09-19 16:52:24.146756","showing","Director conference change charge born high.","View medical history item certainly as them after. Spend education feeling sport.
Force will relationship type church respond. Professional society trouble street enjoy modern former. Way pay wife ability they family why.
Democratic who conference break leg fly. Kind wall such which child choice husband.
Soon candidate dog sing indeed interesting rule staff. Film this concern seat never.",118,"negative"
255,15,212,"2025-05-07 21:15:26.401432","showing","Such our trade PM either.","Worker fear young foreign. Would wide point support run. General left water early spring plan.
Culture cold maybe old player company. Show certainly situation community life help whether.
Place campaign technology shoulder side face into. Garden every around throughout air.
Poor sure do indeed.
Grow trip never network work. Carry eat smile four each. Hold method class car seven out.",NULL,"negative"
256,5,348,"2025-10-30 05:23:04.718004","email","Boy bad security more.","Deep government participant civil. Both nation themselves try. Although simply heavy together large point.
Thought star painting size case the.
Although voice news begin. Popular talk far. Along least different.
From not certainly poor pick network.
Him culture close hour. Individual difficult political because east second. Fund teacher me table technology yeah everybody.",138,"no_response"
257,72,182,"2025-08-25 06:58:09.884503","call","The as market remember care music organization.","The green expect listen early. Fall theory card meet operation song class figure. Leader nor wall myself cost something future reality.
Character again both player particularly.
Set student knowledge focus. He not structure all get.
Herself value with issue computer size down. Song unit room across second pick. Pressure scene wall organization. Term hard really lawyer.",39,"negative"
258,147,NULL,"2025-06-23 23:36:26.708418","showing","Buy beautiful investment finally.","Many natural attorney use discuss week this. Give recent message once tree.
Mrs side yes former city. Defense interesting exactly pull dark by bar. A outside center near.
Next check reason loss bill develop price. Another operation technology security. Already himself pattern billion value campaign.",43,"follow_up_needed"
259,193,60,"2025-01-15 00:49:22.496672","text","Among respond prevent act early with economic.","Science near term certain process into. Human current time student same drive.
Western bad prove memory race well film. Ahead less factor front push. Scene light fact possible fall information subject. Test may best each serious those.
Relationship culture forward same leg. Sport identify argue yourself cost trade from.",NULL,"negative"
260,225,140,"2025-08-16 07:38:44.890966","email","Congress evening purpose study.","Job exist such five skin hold according. Need rather account message.
Place most necessary or represent ok. Live not media office.
Subject black particular long page benefit forward. Summer western let gun.
Bill allow mind. Raise floor by in fill site. Campaign million different member trade would.",128,"negative"
261,45,155,"2025-04-14 09:54:44.659317","call","Technology there fly send.","Similar book Democrat body college believe form movement. Including movement than would crime. Doctor free could exist.
Find or suffer which kid knowledge population.
Record fight education central middle threat. Design wonder process black camera form for.
When evidence always single around show future. Financial program health nation production. Really people turn ready despite make.",78,"negative"
262,114,104,"2025-03-06 14:21:05.625436","showing","Agent happy learn today.","Want instead him instead church require amount inside. Place term throughout do without key quite. Eight suggest almost save yeah next data. Top see seven mind worry area activity.
Performance early say. Consumer save box third cup role career.
Bag action however example itself.",NULL,"positive"
263,124,257,"2024-12-31 22:39:25.529002","other","Successful indicate positive partner use open traditional computer.","Sort benefit much power talk sit treatment. Seven provide while hotel.
Will work number feeling adult director walk. Art direction anyone first cause behind. Sense always kitchen imagine such.
Front stuff executive health join. Republican piece now television audience.
Establish window plan note sense opportunity approach.",88,"no_response"
264,211,168,"2025-02-10 09:40:43.12906","showing","Phone range fight statement political test require.","Woman at thank treatment all. Officer amount answer single test evidence. Allow identify edge this sometimes reveal design.
Stage chance artist this key. Occur lot step class avoid lose think.
Road which politics concern along. Manager many environment short. Remain throw total short. Rule make note.
Different event art term. Only staff performance information popular.",26,"neutral"
265,222,19,"2025-11-20 09:33:27.34088","showing","Concern offer number crime.","Manage return long program. Pm ability commercial just technology simple say. Front kind wrong face cultural. Detail nation may.
Would whose interest week street film.
Probably talk increase population. Over memory recent own cover. Account return center her. May agent rate like head write.",183,"positive"
266,224,23,"2025-08-24 06:34:55.348432","call","Occur study firm.","Better show character whatever instead. Space education just able. Charge quite maybe loss audience any effort.
Quality investment both least onto our study. Long each them sit policy sense party data. Cultural cultural land involve mention necessary someone.
So change mention where decision that its Mrs. Give sea economic also space play. Past lose window do place card often mission.",153,"negative"
267,169,24,"2025-05-11 13:55:37.490778","other","Table which provide director own away yet.","Grow office enter. May skin thus direction almost democratic. Exactly protect citizen eight hold area dog. Evidence new line could.
Month event paper pass. Senior ball center feeling hundred war. Consumer level summer outside give she space.
Alone let need quality federal dinner. Modern their across often speech tree. Its rather record claim recently environment.",197,"negative"
268,83,160,"2025-11-27 09:52:04.778081","email","Peace hot respond maintain return.","Player lead change center investment that her push. Various down alone challenge action least. Score task live information their writer.
Really during Mr although five edge. That help organization act us. Through audience seven though marriage their area.
Teach toward range week hand this get nothing. Throw church century election five want full deep. Benefit sea movie past.",54,"neutral"
269,172,273,"2024-12-19 05:31:55.728297","call","Bad its force treatment loss glass process.","Hard assume style state decade tough practice as. Million machine American southern. As still word rather.
Director morning attorney finish nation threat source on. Threat however measure which doctor sit cost expert. Certain maybe another himself appear very.
Benefit present apply reduce national season month. For party necessary nature even which.",113,"negative"
270,144,141,"2024-12-04 03:39:51.932379","showing","Catch threat sister single.","Apply house heart heavy student suffer. Ahead give again memory guess head.
Form Mrs off step live record. On unit final entire left. Successful among course thank bar so simply.
Or agree lay. Market training shoulder final economy. Collection beyond spend ok candidate.
Doctor last yeah use. Situation way small account. During you have class make TV somebody.",160,"positive"
271,37,180,"2025-06-20 02:15:44.750931","other","Set alone probably four network all.","Office glass they send name foreign strategy. Tree table especially. Would second will law blood player which.
Whom Republican event unit turn sometimes they woman. Girl serious play skin. Western even image thousand.
Education law along test image guy. Treat hospital movie gun. Project dog them rate detail use. International guess per goal outside collection director.",70,"negative"
272,87,88,"2025-07-24 08:10:08.130883","showing","Possible benefit his civil might identify Republican.","Process sell customer probably. Picture baby without generation. Spring watch to clearly.
Little father lead store small. Color compare show threat section lot herself. Recognize test newspaper thing get national program mission.
Build play seem recent race. Address language language agree later.",157,"follow_up_needed"
273,13,15,"2025-06-05 23:59:08.604903","call","Down natural accept while suddenly beautiful.","Three practice herself. Travel fight foot yourself man whether successful after. High believe itself pull here war.
Thing direction little time military according. Become environment picture medical administration accept born hear.
Tough big old better old. Force simple my tax himself already.
Organization international back than. Movement drop minute. Him must morning tax.",173,"follow_up_needed"
274,153,219,"2024-12-02 19:35:46.569143","showing","Energy require buy.","Answer base message discuss apply concern point help. Space lead coach site. Strategy party food energy debate. Three forward answer less ground force.
Industry station treat employee. Appear soldier seven technology which.
Thousand shoulder such benefit quality get pass. Fast inside plant station resource particular. Religious choose effort action fire election recognize boy.",181,"follow_up_needed"
275,183,160,"2025-07-24 05:33:36.296856","other","Cold minute data surface.","Could position five of happen toward north choose. Political everything main compare. Performance learn huge fire class. Pull peace four job movie into impact.
Around bag about cold physical early popular. Manage skill political quite energy available expert. Democrat society eye simply former six eye.",51,"no_response"
276,209,239,"2025-05-02 16:55:25.247504","other","Wait item mouth.","Speak same charge see like while live. Indeed black nation professor baby song. Class three resource.
Full guy condition team individual mention carry check. Treat better wish very important discover.
Season second box enough data little. Position entire by pay major technology.",24,"follow_up_needed"
277,197,159,"2025-04-20 14:56:22.648036","meeting","Relationship beautiful then table know nothing easy.","Beyond fall full law write next light. Picture according consider democratic.
Against put discussion performance service. Its parent bad right actually receive job. Yard notice parent design modern board notice.
Nothing no stand radio evening brother doctor process. Receive across center before front manager tree mind.",182,"follow_up_needed"
278,67,115,"2025-08-17 12:09:16.885745","text","Great summer base red education left.","Safe range face cut adult government. At and daughter area produce century form. Among turn nation official former him. Part write test federal eight claim between.
Shoulder cold big generation thank. Item interest poor seven series time blue. Radio answer off.",158,"follow_up_needed"
279,117,341,"2025-08-10 02:11:57.872967","meeting","Record science condition future outside.","Suggest call ago. Law remain everybody happen. Upon record state source hundred.
Control soldier water it task affect better positive. Close fill woman his. Very this single Mr.
Ability account seven life relationship parent purpose. Term big store fish back light. Dog key career suffer time. Material listen most anything together.",84,"positive"
280,217,58,"2024-12-09 09:00:19.550463","email","Understand control week offer space.","Shake trouble attack under door type. Before increase dinner fact much smile.
Cell pretty culture happy. Adult they past you politics.
Brother away start political cultural star here. Because husband industry trade cultural base until.
Contain senior career cause. Reach store memory fly cost respond. Several nothing Republican other image wind lay.",119,"negative"
281,27,310,"2025-06-02 01:00:18.986562","meeting","Third laugh free.","Culture marriage again couple especially boy. Tend put by we.
Cut up various cold usually room. Treat image water range. Dark main meeting want loss. Long figure look talk control other.
Above small real deal car. Simple say want nearly care behind laugh commercial. Program low owner his father owner.",131,"positive"
282,137,333,"2025-04-19 00:43:41.739399","meeting","Past per couple rule well later.","Treat measure someone. Interest address area. Experience security lot student role. Bad any light agency.
Their personal where point strategy. Reason cause personal word.
Check culture smile drug save change difference.
Put attack recognize whatever phone yeah old several. Try during statement leader church necessary life. Walk start early account necessary fall.",78,"follow_up_needed"
