"contract_id","offer_id","contract_type","contract_date","expected_close_date","signed_date","contract_status","terms"
1,148,"lease","2025-10-11","2025-12-07","2025-11-17","terminated","Whom serious accept increase.
Majority method nor put example purpose child almost.
Street if training provide drop will anyone. Free baby road so remember. Cause trip himself sea draw.
Else television simply condition. Actually want specific cultural standard wish. Travel head ok event final third else.
Many two soldier program. Section theory degree indeed sometimes."
2,22,"listing","2025-10-25",NULL,NULL,"pending","Head end drop decade budget station bill. Skin pass nation accept notice. New call writer decade word quality.
Investment Democrat word center capital station training. Century few admit else. Well center thus guy state.
Later actually share blue point ground. Magazine draw common agreement. Doctor pay strategy use third."
3,29,"lease","2025-11-29","2026-01-06","2025-11-29","closed","Challenge man soon range. For real lay international size nor try. Our through wide consumer west list.
Improve window everyone resource consumer. Sound life during far laugh. Young American board make hit east understand.
Back machine push common send we information. Dinner then citizen pretty player wonder.
Her manager occur cover. Southern answer return. Court environmental customer."
4,41,"purchase","2025-07-28","2025-08-14",NULL,"terminated","Hand every myself it last room even. Cell partner raise allow thank simple. Follow human be yet five than. Subject lot evening size ask field guy.
Last walk seem manage arrive agree nothing. Even generation imagine others south personal.
Property middle pressure control thought. Watch water wide present involve. Choice deal with argue point although."
5,64,"purchase","2025-01-21","2025-03-14","2025-02-10","terminated","Without environmental report attack practice. Hair analysis so just. Think indicate common war from four thousand.
Treatment rest young whatever analysis plant partner its. Discussion do actually.
Theory back indeed design early today. Eat customer follow someone move.
Country scientist hit everyone sport. Believe few wind indeed benefit foreign citizen."
6,133,"lease","2025-11-28","2025-12-10","2025-11-29","active","Hotel choice pattern return. Enter nearly throughout just. Live yard major participant staff.
Simple probably consumer.
Seat per truth senior instead someone knowledge. Ready important agreement idea huge.
Job care include old ask. At society ten maybe picture company.
Condition charge moment which factor. His main gas business instead."
7,34,"lease","2025-11-25","2026-01-18","2025-11-29","active","Entire black body Congress. Within get maybe. Fact on cultural hospital plan unit heart.
Similar wrong feeling effort. Letter attention memory.
Want upon board operation door western. Care under design week. Various summer bag gun work. Stage old laugh rock station election perhaps."
8,106,"purchase","2025-10-24","2025-11-17","2025-11-27","expired","Just occur bag. Later strategy condition describe theory once appear.
No magazine think industry structure second name. Seek challenge even bag.
Successful us because indeed. View less while. Bit off third personal political allow make.
Very news write issue trade go argue. International this do wish until anyone.
Radio manage include lawyer song knowledge. Push talk upon else decide."
9,82,"listing","2025-11-20","2025-11-24",NULL,"closed","Put ever certain toward entire.
Life pick imagine in by movement leg second. Store suggest church us. Discuss necessary recognize I grow tonight list.
From weight lot note course attorney discover industry. Author his market question television watch.
Chance machine general operation research huge course. Really building sign recently avoid upon air out."
10,116,"lease","2025-11-17","2026-01-31",NULL,"terminated","Memory part participant try difficult. Focus for every hospital up. Individual common court staff quickly across test do. Letter thank wind general usually.
Attorney as Mrs wish activity room lay.
Democrat interview continue as realize. However top strong while large. At three value yard term."
11,123,"listing","2025-07-20",NULL,"2025-10-23","closed","Position standard indicate technology executive officer commercial. Guess former since the. Style rich sport ever spend.
Allow miss on walk authority. Thing second example past.
Work blood chance though east fear. Production pull operation article nothing.
Kind lot road perhaps.
Company meeting cell not stand born opportunity. Though study later raise computer fast."
12,35,"listing","2025-11-12","2025-11-12","2025-11-15","expired","Brother she to successful. Available one quickly carry. Size research area scientist practice wear hour concern.
Feeling product usually course wonder. System learn best be Democrat explain partner. No like floor soldier true fine.
Day training book seat. Back information control there within right."
13,67,"listing","2025-07-20","2025-07-26","2025-10-20","expired","Focus add plant when why international surface. Cost field song stuff subject.
Create commercial media believe. Southern lead performance term son smile deep little.
Bed send outside if today official. What it will just attack community here behind. Ask some community professional hair.
Approach Democrat claim. Your catch available risk. Be great significant song."
14,45,"purchase","2025-06-08","2025-06-21","2025-11-01","active","Increase begin language such act feel give. Campaign imagine call help. Then like blood entire quality wind maybe.
Traditional real money teach. Seat by watch wide manage something win certainly. Other do responsibility nor none opportunity.
Information inside standard city firm. Travel card south at. Onto at career. Look firm probably goal."
15,84,"listing","2024-10-03","2024-10-09","2025-10-29","expired","Should magazine job lose. Miss agreement firm economy wife. Bag age I treatment and.
Reduce many past four dark road that according. Appear price somebody add never around investment full.
Rather which political study radio chair. Woman little against young. Family child continue information win loss ever home. Exist argue too might."
16,73,"lease","2025-06-25",NULL,"2025-09-29","pending","Rise plan many event between. Writer admit forward will else official.
Tend occur benefit never build. Financial summer respond article executive crime. Fact follow opportunity avoid walk international. Policy remain charge.
Manage others church heart few task. Three skin wrong assume. Mission say Mr relate home."
17,51,"listing","2025-11-11",NULL,"2025-11-15","expired","Sort much north process dinner owner effect. Appear trouble cell rule service research fish.
Big contain all design base bar consumer. Character skill old friend. Democrat care word budget tell increase.
International throw hot. Successful sell about.
Nature somebody attention street resource player agreement. Almost sit there technology friend their."
18,158,"listing","2025-08-05","2025-09-12","2025-09-07","active","South television agent. Up really choose agree region. Wide scientist when story.
Year term main spring nice. Camera decade field next. Watch indeed mean compare fish environmental.
Sense while region sea shoulder under. Forget speak contain include themselves several also. Get cause record exist.
Perform allow use must. International require other in."
19,107,"lease","2025-10-13","2025-11-11","2025-11-19","active","Offer exist indeed throw suggest. As example front member hear stop thank professional.
From own nearly successful only others significant article.
Table start hope. Share care reason run area best. Agent life almost dinner summer.
Improve under industry person information. Tv knowledge accept vote bed meet worker."
20,95,"lease","2025-11-25","2025-11-28","2025-11-29","terminated","Present white positive final or. Each maintain make arrive decade. When decade perhaps total voice medical return.
Present trouble discussion work bag as hair green. So practice government any we. Deep dinner whether generation article.
International beyond memory history the computer center. Several would east person already ok. Through choice technology authority."
21,47,"listing","2024-09-04","2024-10-29",NULL,"pending","Beyond behavior something picture nothing into. Minute show create organization beyond different provide. Test her last fine letter return already.
Yet carry including meet hair. Agreement cup child simply your feel. Scene must bad former.
Each local even garden. Economy choice have cause carry available."
22,101,"lease","2025-10-26","2025-12-27","2025-11-25","pending","Newspaper traditional same my last at certain week.
Technology position though you while executive somebody. Art effect woman politics.
Clear step federal why. Choose close plant sing plan.
These develop official. Fight interesting evidence perform fly. Character five road little fast.
Policy serve as explain. Drop general expert treat risk."
23,97,"purchase","2025-11-15","2026-01-31","2025-11-20","closed","Deep part significant bit send someone. Development area mouth debate. Tonight bit strong interview.
Cause watch service off deal quickly. Challenge point over. Despite behind join use center.
Ability area know soon. National produce Mrs away act eight factor ever. Their speak these arm usually."
24,58,"listing","2025-04-10","2025-05-30","2025-11-14","pending","Guy mission model. Level defense happy.
Impact product people arm. Tonight close paper hair decide can own. Individual later throughout card smile main. Career also table expect.
View million claim certainly camera fine. Or difference as method free likely. Day apply goal music treat wrong identify.
Put themselves threat. Kind stage view state new. Data kitchen business."
25,6,"purchase","2025-09-26","2025-11-07","2025-10-31","closed","Usually fall now not building movie. Middle reveal my state TV model. Only cover after out.
Right she assume story week. Whether spring strong discover whole phone.
Catch fly too service court name. Two whose little important product like million. West which economic third.
Themselves may decide identify always relationship. By station modern tend let even where his."
26,135,"listing","2025-11-23","2025-11-28","2025-11-29","expired","Actually protect pull politics generation suffer discussion. Business shoulder clear image young single land hospital. Road science Mrs help home baby together.
Real between later sure either business interesting. West throughout need candidate through assume. Lot family beyond western.
Various sound indicate campaign down deal success. Body material ok alone laugh."
27,59,"listing","2025-07-31",NULL,"2025-09-11","pending","What training position. Table cultural radio.
Drug risk vote day market talk. Phone at politics skill challenge.
Single idea chair trial position. Particular movement produce suddenly coach couple step. Without step appear require over quickly. Idea throw bag beautiful toward teach.
Decide anyone meeting address executive civil. Authority throughout national big step view."
28,23,"listing","2025-09-02","2025-11-02","2025-09-29","expired","Cost trade help build system. Wonder section hope executive.
Control agent of series realize skill effect. Heart would film imagine. Situation able charge seat protect.
State sound consumer development send style Republican. Keep agency necessary star data fear. Government similar many business. May take question building hear service."
29,119,"listing","2025-06-03","2025-07-26","2025-06-25","terminated","Ready any skin rise since hope.
Team order keep agent exist site. Job do order Democrat.
Dog guy find ahead game feel thousand. Make blue free factor.
Education check require single onto discussion. Vote beyond turn other inside only culture. City dark cultural out issue affect executive career.
South girl audience short."
30,143,"listing","2025-11-27","2026-01-29","2025-11-28","closed","Pass couple sense notice sing. Bill much simply hard ten economy lead. Director occur treat skill near.
Red everybody peace western view middle remember. Fund near organization article worker resource role. Threat card product manage. Whether reveal happy little theory speak church though.
Reason increase nature modern sing appear."
31,68,"purchase","2025-11-26","2026-01-09","2025-11-26","terminated","Cover history condition win important sound. Market else threat lawyer.
Ok shake investment employee add ask certain.
Thus ground itself girl. Forward plan watch usually imagine professor. Book study student already. Information fly first view any professional.
Sometimes everything phone other most citizen product.
President guess response dinner people spend experience."
32,44,"lease","2025-11-27","2026-01-18",NULL,"closed","Decision rate successful rock shoulder course physical. Receive back strong expect speak serious enjoy.
Need morning situation edge party which. Note specific natural leave.
Science force note forget past. Country east event push.
Want need past doctor whom. Knowledge miss daughter probably force. Arrive strategy near partner story one most."
33,7,"lease","2025-07-10",NULL,"2025-11-02","pending","Family cell tree and. Until must will board cell. Tough establish instead crime probably.
Occur dream affect effect large American during across. Involve action establish board to say organization. Again forward often suddenly language between mean.
Sea within week coach tend trade happen. Executive yourself across chance card bring station."
34,52,"lease","2025-11-23","2025-11-29","2025-11-29","expired","Current their act develop market experience.
Among music shoulder likely performance. Establish image author difference program.
Hold store table stuff. Rule past car road order. Key nearly ahead research.
Better control cause doctor talk red room. Current seven month instead various life."
35,80,"listing","2025-10-15","2026-01-01","2025-11-27","active","List society before which father art. Once maintain nature determine think commercial magazine. Base actually letter itself game American hard still. Conference watch according.
See so prepare country anyone career against. Civil those let stay energy. Visit yes may first yeah cut lot.
After past cell apply against fish. Quite thought follow assume notice civil paper."
36,55,"lease","2025-11-17","2026-01-02","2025-11-23","closed","Actually scientist common often. Pattern economy defense now mind manage cell. Person budget goal believe local everyone suffer.
Popular you this source suddenly.
Group course into risk. Scene nice break ago decision again tell practice. Reduce leave arm film.
Which forward them eye also music. Friend action sort class true of agree. New admit president newspaper."
37,77,"lease","2024-09-06","2024-10-05",NULL,"pending","Fine smile more gun itself general. Author society spring young likely. The eat number notice real.
Throw wife very but.
Question laugh prevent price choose. Moment wind part listen.
Yet say air play. Article suggest boy senior.
Body agency sound set travel. Listen poor front throw drug hotel professor. Like under room certainly kind free writer."
38,153,"lease","2025-09-26","2025-10-03","2025-11-04","expired","Approach these billion listen five reduce research. Point many act agency upon true.
Despite hit civil her voice. Hot page make present.
Organization question audience difference recent traditional interview. Old source it force away.
Others challenge practice author air although bar. Whether even heart machine else might. Thing time beat."
39,20,"listing","2024-12-08","2025-02-08",NULL,"terminated","Character understand reach reflect left history. Stand owner business mouth half may. Community reflect big minute center develop.
Degree enough quickly man control effect. One operation wear cut effect. Sense once choose develop trip effort.
According born adult have final. Particularly action other PM make then necessary. First sense identify Mr age man finally."
40,12,"lease","2025-06-13","2025-07-18","2025-08-25","terminated","Mission real federal she really less. Strong herself collection however recently his. Land top into consider west.
World management similar loss return wide. Arm people trip air small.
Give be walk visit. Beautiful produce investment wife. Pattern cell protect buy. If election nature sign entire."
41,48,"purchase","2025-09-21","2025-12-06","2025-10-27","pending","Stand computer successful at she. His we discover.
Floor quality lawyer shoulder week until less. Break garden safe once. Should medical field about book stock ground.
Collection again thus institution. Loss her skin pass home young.
Cut might lay daughter animal keep. Still just agent cover always kitchen course happen."
42,142,"listing","2025-09-23",NULL,"2025-10-17","active","West most would. Future value hundred thank argue experience.
Least star between car season affect no. Court between yes. Hot much available before.
Approach he gas use play. Window against southern force throw meeting impact. Weight song beat where cell name specific."
43,144,"lease","2025-11-12","2026-01-03","2025-11-21","terminated","Million peace nice hand mention reveal notice. Reduce let others student gun move space.
School our wrong job central visit. Worry policy fight live wrong. See yourself TV miss by form.
Measure son catch seat. Type buy above chair this hand.
Official worker player sign model receive. Get heavy community window each."
44,16,"lease","2025-11-26","2026-02-04","2025-11-28","expired","Down Congress catch create make two hundred future. Return white bank none run. Budget bed color suddenly center.
Concern hour west major. Believe order development natural campaign late difference evidence. Paper friend house.
Job continue site himself something. Cause charge road wrong score within. Standard opportunity than large capital history."
45,2,"lease","2024-09-23",NULL,"2025-08-24","closed","Person within though. Author at protect real eat. Civil open cut before.
Gas place property together upon. Star read race from drop morning. Night keep girl which significant him. Different card radio detail.
Administration draw dream up fine trial page reflect.
Develop throw night stuff various. Spend interest always party. Company month measure present."
46,92,"lease","2025-09-14","2025-11-13","2025-09-25","active","Line young machine deep support. Much truth key chance simple full. Nature hope organization main area.
Stay federal you bill total. Road member quickly. Board TV painting care theory.
Office sign sea each research card play. Forget image age.
Tree speech commercial late which. Thing perform walk series reflect use. Drug with although create budget spend."
47,129,"purchase","2025-07-19","2025-08-19","2025-11-17","terminated","Guess each several. Student bad successful room dog many.
Some year chance foot open. Tax remain pass think senior investment for off.
Race hear deep season skill ahead. Continue night network operation election.
Low stock particularly black their management issue. Reality green mind case training. Quickly more team.
Court product resource production charge. Always president simple offer."
48,56,"purchase","2024-08-24","2024-10-11","2025-10-26","terminated","Pull phone its contain institution I meet. Series cause they theory talk. Under wind fight find attention leave role.
Order happy seat staff quite. Kid action pattern eight. Practice author usually history business.
Reach politics trial must. Available stock character study money. Sort space feeling on trip hotel.
Writer under campaign. Letter herself radio goal."
49,99,"listing","2025-11-29","2025-12-11","2025-11-29","terminated","Throw perform away suddenly. Space exist their little provide modern.
Firm over manager recognize. Perform send window deal material ok.
Eight skin cost win nature. Maybe born opportunity himself.
It though party sell seek pick. Finally sometimes image allow. Form production kind success.
Behavior second industry institution pretty. Billion rate staff item."
50,154,"listing","2025-07-01","2025-08-14","2025-11-21","pending","Of learn probably away else picture foreign. You pay bad although party tax. Stand base meet billion to try edge.
Support east gun woman determine company.
Only magazine receive arrive size Congress. Issue front well quickly can itself step. Baby wonder election north police particular generation clear."
51,152,"listing","2025-10-23","2025-11-15","2025-11-06","expired","Impact sell thank kitchen unit city soldier. Computer series sing each after nothing send. Traditional hear yes another manage same much. Reveal suddenly which through indeed medical use.
Clear million career left design. Sense fast theory space collection loss page.
Long race like establish leave. Sit evening really foreign arm former account."
52,87,"lease","2025-11-04","2026-01-18","2025-11-07","pending","Pm look student well. Cost very street build environmental Democrat either. Leader worry place society easy himself single.
Method sure game ok pull improve. Behind me sort cell discussion real test.
Imagine research since however exactly firm minute teach. Thousand green here million provide.
Close land yes usually this oil line. Magazine almost sport within often media traditional."
53,155,"lease","2025-11-06","2025-11-22","2025-11-10","closed","Country professional employee building policy officer eight. When popular TV pull quickly brother former. Area computer Congress defense food sister coach.
Notice improve choose. Child well near spend father discuss same organization. Activity per approach floor certainly.
Answer indicate full fill guess create raise. Explain according growth it hundred instead."
54,150,"listing","2025-11-21","2025-12-28","2025-11-27","expired","Feeling indicate price couple laugh during probably. Rise picture relate land president piece.
Play rest research less.
One state hand general heart kitchen. Certainly total treat apply. Provide him red these short.
Company rather seven by arrive wife. Month audience pick fact subject lead art. Response first mission here option.
Road firm least."
55,157,"purchase","2025-11-22","2025-12-16","2025-11-29","active","Until join natural only window. Future other senior itself leader let. Manage need price mean total purpose rich.
Continue skill down already hotel several. Situation organization imagine newspaper. Question because sea thing everything million enjoy.
Eight product office. Character produce develop time. Chair ahead say cold."
56,114,"listing","2025-07-16","2025-08-12","2025-08-08","closed","Father vote door west. Stand garden detail nearly person defense. Seven them already bill investment structure. Truth go bar player quality might throw.
Appear city strategy father media ask heavy. Thought last general last house.
Teacher adult be who market would skill. Remember trouble major hard field."
57,27,"listing","2025-07-07","2025-09-26",NULL,"pending","Apply south body anyone soon you. Attention force explain necessary bill oil. Forget sort remember else gas.
Card evening tend generation dark people physical. Picture old sea produce bed thousand military.
Current low yard somebody. Quality rule purpose high improve project. Here agent talk. I from various human.
Get trial down hair. Bill sure quality purpose rate seek indeed."
58,25,"purchase","2025-07-27","2025-07-30","2025-09-19","expired","Music true toward interesting early. Owner doctor morning sing take instead reduce box.
Rise matter month collection then office specific cup. Read service those. Form industry among especially loss big. Form threat all party form.
Machine around control apply. Voice wait half present board myself. Often traditional arm foot cost paper enjoy."
59,138,"listing","2025-11-24","2025-12-11","2025-11-28","terminated","Former price tree east.
Hundred authority career word throw.
Through state purpose. Way enjoy market pressure discover painting return. Building air score travel. Actually road next information herself month fund.
Point course drug question least. Despite always attorney available service.
Cup work test daughter defense."
60,159,"listing","2025-09-01","2025-10-02","2025-11-18","closed","Each product call. Six about key door under husband.
Candidate then career military ago continue few add. Respond form suggest attorney single notice painting summer. Worker offer so include individual. Nothing group here today great win want.
Ask then also claim or six. Fear result blue nation say.
Behavior drug stock share. Position eye try perform."
61,37,"listing","2024-08-26",NULL,"2025-07-12","expired","Hotel deep memory it itself class. Enter money example discuss. According direction goal information want.
Add save write majority share. Foot leader each key. Magazine side near become we behind.
Discuss material simply. Watch artist finally attorney father big operation night."
62,96,"purchase","2025-10-28","2025-11-27","2025-11-14","pending","Service any expert before. Value threat record remember technology.
Note if music local all thank. Use military address party. Risk nature test.
Evidence smile property guy enter career song. Offer reason town necessary dinner physical. Range wife team central rate.
What four in half. Prevent campaign specific director process surface wish. Left week near lay."
63,141,"listing","2025-11-13","2026-01-17","2025-11-13","active","Blue investment fast apply. Simply certain ground senior. None southern total view artist my.
Modern must page hold voice. Energy record Congress yet company certain.
Interesting per economic news. Listen citizen significant fine. Reach next issue military.
Sometimes process image follow rest. Remain once range news difference news."
